12:51:38.372623 IP DESKTOP-P4R322P.lan.53772 > 10.42.0.39.http: Flags [S], seq 3867181675, win 64240, options [mss 1460,sackOK,TS val 3003182598 ecr 0,nop,wscale 7], length 0
12:51:38.372660 IP 10.42.0.39.http > DESKTOP-P4R322P.lan.53772: Flags [S.], seq 1448722396, ack 3867181676, win 64308, options [mss 1410,sackOK,TS val 1949511107 ecr 3003182598,nop,wscale 7], length 0
12:51:38.375935 IP DESKTOP-P4R322P.lan.53772 > 10.42.0.39.http: Flags [.], ack 1, win 502, options [nop,nop,TS val 3003182704 ecr 1949511107], length 0
12:51:38.377273 IP DESKTOP-P4R322P.lan.53772 > 10.42.0.39.http: Flags [P.], seq 1:78, ack 1, win 502, options [nop,nop,TS val 3003182704 ecr 1949511107], length 77: HTTP: GET / HTTP/1.1
12:51:38.377296 IP 10.42.0.39.http > DESKTOP-P4R322P.lan.53772: Flags [.], ack 78, win 502, options [nop,nop,TS val 1949511112 ecr 3003182704], length 0
12:51:38.377690 IP 10.42.0.39.http > DESKTOP-P4R322P.lan.53772: Flags [P.], seq 1:163, ack 78, win 502, options [nop,nop,TS val 1949511112 ecr 3003182704], length 162: HTTP: HTTP/1.1 200 OK
12:51:38.377850 IP 10.42.0.39.http > DESKTOP-P4R322P.lan.53772: Flags [FP.], seq 163:1354, ack 78, win 502, options [nop,nop,TS val 1949511112 ecr 3003182704], length 1191: HTTP
12:51:38.385810 IP DESKTOP-P4R322P.lan.53772 > 10.42.0.39.http: Flags [.], ack 163, win 501, options [nop,nop,TS val 3003182713 ecr 1949511112], length 0
12:51:38.385822 IP DESKTOP-P4R322P.lan.53772 > 10.42.0.39.http: Flags [.], ack 1355, win 501, options [nop,nop,TS val 3003182713 ecr 1949511112], length 0
12:51:38.387065 IP DESKTOP-P4R322P.lan.53772 > 10.42.0.39.http: Flags [F.], seq 78, ack 1355, win 501, options [nop,nop,TS val 3003182713 ecr 1949511112], length 0
12:51:38.387092 IP 10.42.0.39.http > DESKTOP-P4R322P.lan.53772: Flags [.], ack 79, win 502, options [nop,nop,TS val 1949511121 ecr 3003182713], length 0
12:51:39.086682 IP DESKTOP-P4R322P.lan.53788 > 10.42.0.39.http: Flags [S], seq 3263119355, win 64240, options [mss 1460,sackOK,TS val 3003183340 ecr 0,nop,wscale 7], length 0
12:51:39.086724 IP 10.42.0.39.http > DESKTOP-P4R322P.lan.53788: Flags [S.], seq 4100411614, ack 3263119356, win 64308, options [mss 1410,sackOK,TS val 1949511821 ecr 3003183340,nop,wscale 7], length 0
12:51:39.093079 IP DESKTOP-P4R322P.lan.53788 > 10.42.0.39.http: Flags [.], ack 1, win 502, options [nop,nop,TS val 3003183419 ecr 1949511821], length 0
12:51:39.093089 IP DESKTOP-P4R322P.lan.53788 > 10.42.0.39.http: Flags [P.], seq 1:78, ack 1, win 502, options [nop,nop,TS val 3003183419 ecr 1949511821], length 77: HTTP: GET / HTTP/1.1
12:51:39.093132 IP 10.42.0.39.http > DESKTOP-P4R322P.lan.53788: Flags [.], ack 78, win 502, options [nop,nop,TS val 1949511828 ecr 3003183419], length 0
12:51:39.093546 IP 10.42.0.39.http > DESKTOP-P4R322P.lan.53788: Flags [P.], seq 1:163, ack 78, win 502, options [nop,nop,TS val 1949511828 ecr 3003183419], length 162: HTTP: HTTP/1.1 200 OK
12:51:39.093652 IP 10.42.0.39.http > DESKTOP-P4R322P.lan.53788: Flags [FP.], seq 163:1354, ack 78, win 502, options [nop,nop,TS val 1949511828 ecr 3003183419], length 1191: HTTP
12:51:39.101146 IP DESKTOP-P4R322P.lan.53788 > 10.42.0.39.http: Flags [.], ack 163, win 501, options [nop,nop,TS val 3003183427 ecr 1949511828], length 0
12:51:39.101155 IP DESKTOP-P4R322P.lan.53788 > 10.42.0.39.http: Flags [.], ack 1355, win 501, options [nop,nop,TS val 3003183427 ecr 1949511828], length 0
12:51:39.101161 IP DESKTOP-P4R322P.lan.53788 > 10.42.0.39.http: Flags [F.], seq 78, ack 1355, win 501, options [nop,nop,TS val 3003183427 ecr 1949511828], length 0
12:51:39.101199 IP 10.42.0.39.http > DESKTOP-P4R322P.lan.53788: Flags [.], ack 79, win 502, options [nop,nop,TS val 1949511836 ecr 3003183427], length 0
12:51:39.700303 IP DESKTOP-P4R322P.lan.53796 > 10.42.0.39.http: Flags [S], seq 1593055859, win 64240, options [mss 1460,sackOK,TS val 3003183958 ecr 0,nop,wscale 7], length 0
12:51:39.700348 IP 10.42.0.39.http > DESKTOP-P4R322P.lan.53796: Flags [S.], seq 558188734, ack 1593055860, win 64308, options [mss 1410,sackOK,TS val 1949512435 ecr 3003183958,nop,wscale 7], length 0
12:51:39.703728 IP DESKTOP-P4R322P.lan.53796 > 10.42.0.39.http: Flags [.], ack 1, win 502, options [nop,nop,TS val 3003184031 ecr 1949512435], length 0
12:51:39.704637 IP DESKTOP-P4R322P.lan.53796 > 10.42.0.39.http: Flags [P.], seq 1:78, ack 1, win 502, options [nop,nop,TS val 3003184032 ecr 1949512435], length 77: HTTP: GET / HTTP/1.1
12:51:39.704659 IP 10.42.0.39.http > DESKTOP-P4R322P.lan.53796: Flags [.], ack 78, win 502, options [nop,nop,TS val 1949512439 ecr 3003184032], length 0
12:51:39.704930 IP 10.42.0.39.http > DESKTOP-P4R322P.lan.53796: Flags [P.], seq 1:163, ack 78, win 502, options [nop,nop,TS val 1949512439 ecr 3003184032], length 162: HTTP: HTTP/1.1 200 OK
12:51:39.705024 IP 10.42.0.39.http > DESKTOP-P4R322P.lan.53796: Flags [FP.], seq 163:1354, ack 78, win 502, options [nop,nop,TS val 1949512439 ecr 3003184032], length 1191: HTTP
12:51:39.713729 IP DESKTOP-P4R322P.lan.53796 > 10.42.0.39.http: Flags [.], ack 163, win 501, options [nop,nop,TS val 3003184040 ecr 1949512439], length 0
12:51:39.713742 IP DESKTOP-P4R322P.lan.53796 > 10.42.0.39.http: Flags [.], ack 1355, win 501, options [nop,nop,TS val 3003184040 ecr 1949512439], length 0
12:51:39.713749 IP DESKTOP-P4R322P.lan.53796 > 10.42.0.39.http: Flags [F.], seq 78, ack 1355, win 501, options [nop,nop,TS val 3003184040 ecr 1949512439], length 0
12:51:39.713814 IP 10.42.0.39.http > DESKTOP-P4R322P.lan.53796: Flags [.], ack 79, win 502, options [nop,nop,TS val 1949512448 ecr 3003184040], length 0
12:51:40.622437 IP DESKTOP-P4R322P.lan.53806 > 10.42.0.39.http: Flags [S], seq 898263243, win 64240, options [mss 1460,sackOK,TS val 3003184939 ecr 0,nop,wscale 7], length 0
12:51:40.622472 IP 10.42.0.39.http > DESKTOP-P4R322P.lan.53806: Flags [S.], seq 1932931242, ack 898263244, win 64308, options [mss 1410,sackOK,TS val 1949513357 ecr 3003184939,nop,wscale 7], length 0
12:51:40.625884 IP DESKTOP-P4R322P.lan.53806 > 10.42.0.39.http: Flags [.], ack 1, win 502, options [nop,nop,TS val 3003184954 ecr 1949513357], length 0
12:51:40.625898 IP DESKTOP-P4R322P.lan.53806 > 10.42.0.39.http: Flags [P.], seq 1:78, ack 1, win 502, options [nop,nop,TS val 3003184954 ecr 1949513357], length 77: HTTP: GET / HTTP/1.1
12:51:40.625941 IP 10.42.0.39.http > DESKTOP-P4R322P.lan.53806: Flags [.], ack 78, win 502, options [nop,nop,TS val 1949513360 ecr 3003184954], length 0
12:51:40.626255 IP 10.42.0.39.http > DESKTOP-P4R322P.lan.53806: Flags [P.], seq 1:163, ack 78, win 502, options [nop,nop,TS val 1949513361 ecr 3003184954], length 162: HTTP: HTTP/1.1 200 OK
12:51:40.626359 IP 10.42.0.39.http > DESKTOP-P4R322P.lan.53806: Flags [FP.], seq 163:1354, ack 78, win 502, options [nop,nop,TS val 1949513361 ecr 3003184954], length 1191: HTTP
12:51:40.630821 IP DESKTOP-P4R322P.lan.53806 > 10.42.0.39.http: Flags [.], ack 163, win 501, options [nop,nop,TS val 3003184957 ecr 1949513361], length 0
12:51:40.630832 IP DESKTOP-P4R322P.lan.53806 > 10.42.0.39.http: Flags [.], ack 1355, win 501, options [nop,nop,TS val 3003184957 ecr 1949513361], length 0
12:51:40.630842 IP DESKTOP-P4R322P.lan.53806 > 10.42.0.39.http: Flags [F.], seq 78, ack 1355, win 501, options [nop,nop,TS val 3003184957 ecr 1949513361], length 0
12:51:40.630883 IP 10.42.0.39.http > DESKTOP-P4R322P.lan.53806: Flags [.], ack 79, win 502, options [nop,nop,TS val 1949513365 ecr 3003184957], length 0
12:51:41.237083 IP DESKTOP-P4R322P.lan.53824 > 10.42.0.39.http: Flags [S], seq 4264504183, win 64240, options [mss 1460,sackOK,TS val 3003185508 ecr 0,nop,wscale 7], length 0
12:51:41.237119 IP 10.42.0.39.http > DESKTOP-P4R322P.lan.53824: Flags [S.], seq 1634750768, ack 4264504184, win 64308, options [mss 1410,sackOK,TS val 1949513971 ecr 3003185508,nop,wscale 7], length 0
12:51:41.239075 IP DESKTOP-P4R322P.lan.53824 > 10.42.0.39.http: Flags [.], ack 1, win 502, options [nop,nop,TS val 3003185567 ecr 1949513971], length 0
12:51:41.239083 IP DESKTOP-P4R322P.lan.53824 > 10.42.0.39.http: Flags [P.], seq 1:78, ack 1, win 502, options [nop,nop,TS val 3003185567 ecr 1949513971], length 77: HTTP: GET / HTTP/1.1
12:51:41.239118 IP 10.42.0.39.http > DESKTOP-P4R322P.lan.53824: Flags [.], ack 78, win 502, options [nop,nop,TS val 1949513973 ecr 3003185567], length 0
12:51:41.239507 IP 10.42.0.39.http > DESKTOP-P4R322P.lan.53824: Flags [P.], seq 1:163, ack 78, win 502, options [nop,nop,TS val 1949513974 ecr 3003185567], length 162: HTTP: HTTP/1.1 200 OK
12:51:41.239645 IP 10.42.0.39.http > DESKTOP-P4R322P.lan.53824: Flags [FP.], seq 163:1354, ack 78, win 502, options [nop,nop,TS val 1949513974 ecr 3003185567], length 1191: HTTP
12:51:41.243810 IP DESKTOP-P4R322P.lan.53824 > 10.42.0.39.http: Flags [.], ack 163, win 501, options [nop,nop,TS val 3003185571 ecr 1949513974], length 0
12:51:41.243828 IP DESKTOP-P4R322P.lan.53824 > 10.42.0.39.http: Flags [.], ack 1355, win 501, options [nop,nop,TS val 3003185571 ecr 1949513974], length 0
12:51:41.243837 IP DESKTOP-P4R322P.lan.53824 > 10.42.0.39.http: Flags [F.], seq 78, ack 1355, win 501, options [nop,nop,TS val 3003185572 ecr 1949513974], length 0
12:51:41.243907 IP 10.42.0.39.http > DESKTOP-P4R322P.lan.53824: Flags [.], ack 79, win 502, options [nop,nop,TS val 1949513978 ecr 3003185572], length 0
12:51:42.058422 IP DESKTOP-P4R322P.lan.53832 > 10.42.0.39.http: Flags [S], seq 3290881177, win 64240, options [mss 1460,sackOK,TS val 3003186319 ecr 0,nop,wscale 7], length 0
12:51:42.058464 IP 10.42.0.39.http > DESKTOP-P4R322P.lan.53832: Flags [S.], seq 1294957649, ack 3290881178, win 64308, options [mss 1410,sackOK,TS val 1949514793 ecr 3003186319,nop,wscale 7], length 0
12:51:42.063640 IP DESKTOP-P4R322P.lan.53832 > 10.42.0.39.http: Flags [.], ack 1, win 502, options [nop,nop,TS val 3003186389 ecr 1949514793], length 0
12:51:42.063654 IP DESKTOP-P4R322P.lan.53832 > 10.42.0.39.http: Flags [P.], seq 1:78, ack 1, win 502, options [nop,nop,TS val 3003186389 ecr 1949514793], length 77: HTTP: GET / HTTP/1.1
12:51:42.063724 IP 10.42.0.39.http > DESKTOP-P4R322P.lan.53832: Flags [.], ack 78, win 502, options [nop,nop,TS val 1949514798 ecr 3003186389], length 0
12:51:42.064113 IP 10.42.0.39.http > DESKTOP-P4R322P.lan.53832: Flags [P.], seq 1:163, ack 78, win 502, options [nop,nop,TS val 1949514798 ecr 3003186389], length 162: HTTP: HTTP/1.1 200 OK
12:51:42.064205 IP 10.42.0.39.http > DESKTOP-P4R322P.lan.53832: Flags [FP.], seq 163:1354, ack 78, win 502, options [nop,nop,TS val 1949514799 ecr 3003186389], length 1191: HTTP
12:51:42.068088 IP DESKTOP-P4R322P.lan.53832 > 10.42.0.39.http: Flags [.], ack 163, win 501, options [nop,nop,TS val 3003186395 ecr 1949514798], length 0
12:51:42.068098 IP DESKTOP-P4R322P.lan.53832 > 10.42.0.39.http: Flags [.], ack 1355, win 501, options [nop,nop,TS val 3003186395 ecr 1949514799], length 0
12:51:42.068106 IP DESKTOP-P4R322P.lan.53832 > 10.42.0.39.http: Flags [F.], seq 78, ack 1355, win 501, options [nop,nop,TS val 3003186395 ecr 1949514799], length 0
12:51:42.068150 IP 10.42.0.39.http > DESKTOP-P4R322P.lan.53832: Flags [.], ack 79, win 502, options [nop,nop,TS val 1949514803 ecr 3003186395], length 0
12:51:43.578300 ARP, Request who-has 10.42.0.39 tell dc, length 28
12:51:43.578439 ARP, Reply 10.42.0.39 is-at 1a:21:ee:d4:4c:73 (oui Unknown), length 28

