23:18:38.189987 IP6 fe80::1ce7:fd37:e1fe:4c4b.mdns > ff02::fb.mdns: 0*- [0q] 3/0/4 (Cache flush) PTR Living-Room.local., (Cache flush) PTR Living-Room.local., (Cache flush) PTR Living-Room.local. (301)
23:18:38.389139 ARP, Request who-has 10.1.1.248 tell dsldevice.lan, length 46
23:18:38.673908 IP6 dc.45188 > fe80::a691:b1ff:fe1d:611e.domain: 6049+ [1au] PTR? b.f.0.0.0.0.0.0.0.0.0.0.0.0.0.0.0.0.0.0.0.0.0.0.0.0.0.0.2.0.f.f.ip6.arpa. (101)
23:18:38.688381 IP6 fe80::a691:b1ff:fe1d:611e.domain > dc.45188: 6049 NXDomain 0/0/1 (101)
23:18:38.688530 IP6 dc.45188 > fe80::a691:b1ff:fe1d:611e.domain: 6049+ PTR? b.f.0.0.0.0.0.0.0.0.0.0.0.0.0.0.0.0.0.0.0.0.0.0.0.0.0.0.2.0.f.f.ip6.arpa. (90)
23:18:38.691915 IP6 fe80::a691:b1ff:fe1d:611e.domain > dc.45188: 6049 NXDomain 0/0/0 (90)
23:18:38.693953 IP6 dc.55728 > fe80::a691:b1ff:fe1d:611e.domain: 29293+ [1au] PTR? 248.1.1.10.in-addr.arpa. (52)
23:18:38.699609 IP6 fe80::a691:b1ff:fe1d:611e.domain > dc.55728: 29293 NXDomain* 0/0/1 (52)
23:18:38.699657 IP6 dc.55728 > fe80::a691:b1ff:fe1d:611e.domain: 29293+ PTR? 248.1.1.10.in-addr.arpa. (41)
23:18:38.707831 IP6 fe80::a691:b1ff:fe1d:611e.domain > dc.55728: 29293 NXDomain* 0/0/0 (41)
23:18:38.708387 IP6 dc.50865 > fe80::a691:b1ff:fe1d:611e.domain: 2069+ [1au] PTR? 1.1.1.10.in-addr.arpa. (50)
23:18:38.715017 IP6 fe80::a691:b1ff:fe1d:611e.domain > dc.50865: 2069* 1/0/1 PTR dsldevice.lan. (77)
23:18:39.314847 IP6 fe80::1ce7:fd37:e1fe:4c4b.mdns > ff02::fb.mdns: 0 [3a] [3q] [1au] PTR (QM)? _companion-link._tcp.local. PTR (QM)? _rdlink._tcp.local. PTR (QM)? _sleep-proxy._udp.local. (201)
23:18:39.433939 IP Living-Room.lan.mdns > mdns.mcast.net.mdns: 0*- [0q] 20/0/6 (Cache flush) TXT "rpMac=2" "rpHN=8b13df673ee7" "rpFl=0xB6782" "rpMd=AppleTV6,2" "rpVr=550.9.2" "rpMRtID=F1F22215-8C2A-4858-A86C-73897E98B140" "rpAD=9679cdd84dda" "rpBA=CD:CF:79:61:05:1D", PTR _companion-link._tcp.local., PTR Living Room._companion-link._tcp.local., TXT "model=J105aAP", (Cache flush) SRV Living-Room.local.:49153 0 0, (Cache flush) TXT "acl=0" "btaddr=71:7E:26:95:A4:04" "deviceid=CC:D2:81:6A:A4:67" "fex=1d9/St5fF7w4oQY" "features=0x4A7FDFD5,0xBC175FDE" "flags=0x244" "gid=F1A2B191-3910-4CCB-BB81-4C96D4CEC065" "igl=1" "gcgl=1" "model=AppleTV6,2" "protovers=1.1" "pi=03c4b051-fd43-4ad1-844b-ade242df11c7" "psi=F1F22215-8C2A-4858-A86C-73897E98B140" "pk=a22304c072843285d3a7ee7403b7a7e374e3e313c2386147db4ce024864940d6" "srcvers=770.8.1" "osvers=17.5.1" "vv=1", PTR _airplay._tcp.local., PTR Living Room._airplay._tcp.local., (Cache flush) TXT "cn=0,1,2,3" "da=true" "et=0,3,5" "ft=0x4A7FDFD5,0xBC175FDE" "sf=0x244" "md=0,1,2" "am=AppleTV6,2" "pk=a22304c072843285d3a7ee7403b7a7e374e3e313c2386147db4ce024864940d6" "tp=UDP" "vn=65537" "vs=770.8.1" "ov=17.5.1" "vv=1", PTR _raop._tcp.local., PTR CCD2816AA467@Living Room._raop._tcp.local., (Cache flush) SRV Living-Room.local.:7000 0 0, (Cache flush) SRV Living-Room.local.:7000 0 0, (Cache flush) TXT "", PTR _sleep-proxy._udp.local., PTR 70-35-60-63.1 Living Room._sleep-proxy._udp.local., (Cache flush) SRV Living-Room.local.:51794 0 0, (Cache flush) AAAA fe80::1ce7:fd37:e1fe:4c4b, (Cache flush) A 10.1.1.108, (Cache flush) AAAA fd24:87a5:b2fd:0:65:dc85:74df:e0d5 (1406)
23:18:39.436622 IP6 fe80::1ce7:fd37:e1fe:4c4b.mdns > ff02::fb.mdns: 0*- [0q] 20/0/6 (Cache flush) TXT "rpMac=2" "rpHN=8b13df673ee7" "rpFl=0xB6782" "rpMd=AppleTV6,2" "rpVr=550.9.2" "rpMRtID=F1F22215-8C2A-4858-A86C-73897E98B140" "rpAD=9679cdd84dda" "rpBA=CD:CF:79:61:05:1D", PTR _companion-link._tcp.local., PTR Living Room._companion-link._tcp.local., TXT "model=J105aAP", (Cache flush) SRV Living-Room.local.:49153 0 0, (Cache flush) TXT "acl=0" "btaddr=71:7E:26:95:A4:04" "deviceid=CC:D2:81:6A:A4:67" "fex=1d9/St5fF7w4oQY" "features=0x4A7FDFD5,0xBC175FDE" "flags=0x244" "gid=F1A2B191-3910-4CCB-BB81-4C96D4CEC065" "igl=1" "gcgl=1" "model=AppleTV6,2" "protovers=1.1" "pi=03c4b051-fd43-4ad1-844b-ade242df11c7" "psi=F1F22215-8C2A-4858-A86C-73897E98B140" "pk=a22304c072843285d3a7ee7403b7a7e374e3e313c2386147db4ce024864940d6" "srcvers=770.8.1" "osvers=17.5.1" "vv=1", PTR _airplay._tcp.local., PTR Living Room._airplay._tcp.local., (Cache flush) TXT "cn=0,1,2,3" "da=true" "et=0,3,5" "ft=0x4A7FDFD5,0xBC175FDE" "sf=0x244" "md=0,1,2" "am=AppleTV6,2" "pk=a22304c072843285d3a7ee7403b7a7e374e3e313c2386147db4ce024864940d6" "tp=UDP" "vn=65537" "vs=770.8.1" "ov=17.5.1" "vv=1", PTR _raop._tcp.local., PTR CCD2816AA467@Living Room._raop._tcp.local., (Cache flush) SRV Living-Room.local.:7000 0 0, (Cache flush) SRV Living-Room.local.:7000 0 0, (Cache flush) TXT "", PTR _sleep-proxy._udp.local., PTR 70-35-60-63.1 Living Room._sleep-proxy._udp.local., (Cache flush) SRV Living-Room.local.:51794 0 0, (Cache flush) AAAA fe80::1ce7:fd37:e1fe:4c4b, (Cache flush) A 10.1.1.108, (Cache flush) AAAA fd24:87a5:b2fd:0:65:dc85:74df:e0d5 (1406)
23:18:39.698340 IP6 dc.50466 > fe80::a691:b1ff:fe1d:611e.domain: 6521+ [1au] PTR? 108.1.1.10.in-addr.arpa. (52)
23:18:39.707566 IP6 fe80::a691:b1ff:fe1d:611e.domain > dc.50466: 6521* 1/0/1 PTR Living-Room.lan. (81)
23:18:42.199042 IP Living-Room.lan.mdns > mdns.mcast.net.mdns: 0*- [0q] 21/0/1 (Cache flush) TXT "rpMac=2" "rpHN=8b13df673ee7" "rpFl=0xB6782" "rpMd=AppleTV6,2" "rpVr=550.9.2" "rpMRtID=F1F22215-8C2A-4858-A86C-73897E98B140" "rpAD=9679cdd84dda" "rpBA=CD:CF:79:61:05:1D", PTR _companion-link._tcp.local., PTR Living Room._companion-link._tcp.local., TXT "model=J105aAP", (Cache flush) SRV Living-Room.local.:49153 0 0, (Cache flush) TXT "acl=0" "btaddr=71:7E:26:95:A4:04" "deviceid=CC:D2:81:6A:A4:67" "fex=1d9/St5fF7w4oQY" "features=0x4A7FDFD5,0xBC175FDE" "flags=0x244" "gid=F1A2B191-3910-4CCB-BB81-4C96D4CEC065" "igl=1" "gcgl=1" "model=AppleTV6,2" "protovers=1.1" "pi=03c4b051-fd43-4ad1-844b-ade242df11c7" "psi=F1F22215-8C2A-4858-A86C-73897E98B140" "pk=a22304c072843285d3a7ee7403b7a7e374e3e313c2386147db4ce024864940d6" "srcvers=770.8.1" "osvers=17.5.1" "vv=1", PTR _airplay._tcp.local., PTR Living Room._airplay._tcp.local., (Cache flush) TXT "cn=0,1,2,3" "da=true" "et=0,3,5" "ft=0x4A7FDFD5,0xBC175FDE" "sf=0x244" "md=0,1,2" "am=AppleTV6,2" "pk=a22304c072843285d3a7ee7403b7a7e374e3e313c2386147db4ce024864940d6" "tp=UDP" "vn=65537" "vs=770.8.1" "ov=17.5.1" "vv=1", PTR _raop._tcp.local., PTR CCD2816AA467@Living Room._raop._tcp.local., (Cache flush) SRV Living-Room.local.:7000 0 0, (Cache flush) SRV Living-Room.local.:7000 0 0, (Cache flush) TXT "", PTR _sleep-proxy._udp.local., PTR 70-35-60-63.1 Living Room._sleep-proxy._udp.local., (Cache flush) SRV Living-Room.local.:51794 0 0, (Cache flush) PTR Living-Room.local., (Cache flush) PTR Living-Room.local., (Cache flush) PTR Living-Room.local., (Cache flush) A 10.1.1.108 (1441)
23:18:42.199042 IP Living-Room.lan.mdns > mdns.mcast.net.mdns: 0*- [0q] 2/0/1 (Cache flush) AAAA fe80::1ce7:fd37:e1fe:4c4b, (Cache flush) AAAA fd24:87a5:b2fd:0:65:dc85:74df:e0d5 (108)
23:18:42.204592 IP6 fe80::1ce7:fd37:e1fe:4c4b.mdns > ff02::fb.mdns: 0*- [0q] 21/0/1 (Cache flush) TXT "rpMac=2" "rpHN=8b13df673ee7" "rpFl=0xB6782" "rpMd=AppleTV6,2" "rpVr=550.9.2" "rpMRtID=F1F22215-8C2A-4858-A86C-73897E98B140" "rpAD=9679cdd84dda" "rpBA=CD:CF:79:61:05:1D", PTR _companion-link._tcp.local., PTR Living Room._companion-link._tcp.local., TXT "model=J105aAP", (Cache flush) SRV Living-Room.local.:49153 0 0, (Cache flush) TXT "acl=0" "btaddr=71:7E:26:95:A4:04" "deviceid=CC:D2:81:6A:A4:67" "fex=1d9/St5fF7w4oQY" "features=0x4A7FDFD5,0xBC175FDE" "flags=0x244" "gid=F1A2B191-3910-4CCB-BB81-4C96D4CEC065" "igl=1" "gcgl=1" "model=AppleTV6,2" "protovers=1.1" "pi=03c4b051-fd43-4ad1-844b-ade242df11c7" "psi=F1F22215-8C2A-4858-A86C-73897E98B140" "pk=a22304c072843285d3a7ee7403b7a7e374e3e313c2386147db4ce024864940d6" "srcvers=770.8.1" "osvers=17.5.1" "vv=1", PTR _airplay._tcp.local., PTR Living Room._airplay._tcp.local., (Cache flush) TXT "cn=0,1,2,3" "da=true" "et=0,3,5" "ft=0x4A7FDFD5,0xBC175FDE" "sf=0x244" "md=0,1,2" "am=AppleTV6,2" "pk=a22304c072843285d3a7ee7403b7a7e374e3e313c2386147db4ce024864940d6" "tp=UDP" "vn=65537" "vs=770.8.1" "ov=17.5.1" "vv=1", PTR _raop._tcp.local., PTR CCD2816AA467@Living Room._raop._tcp.local., (Cache flush) SRV Living-Room.local.:7000 0 0, (Cache flush) SRV Living-Room.local.:7000 0 0, (Cache flush) TXT "", PTR _sleep-proxy._udp.local., PTR 70-35-60-63.1 Living Room._sleep-proxy._udp.local., (Cache flush) SRV Living-Room.local.:51794 0 0, (Cache flush) PTR Living-Room.local., (Cache flush) PTR Living-Room.local., (Cache flush) PTR Living-Room.local., (Cache flush) A 10.1.1.108 (1441)
23:18:43.856677 IP6 dc > fe80::a691:b1ff:fe1d:611e: ICMP6, neighbor solicitation, who has fe80::a691:b1ff:fe1d:611e, length 32
23:18:43.865743 IP6 fe80::a691:b1ff:fe1d:611e > dc: ICMP6, neighbor advertisement, tgt is fe80::a691:b1ff:fe1d:611e, length 24
23:18:44.225806 ARP, Request who-has 10.1.1.185 tell dsldevice.lan, length 46
23:18:44.817424 IP6 dc.55787 > fe80::a691:b1ff:fe1d:611e.domain: 38106+ [1au] PTR? 185.1.1.10.in-addr.arpa. (52)
23:18:44.822537 IP6 fe80::a691:b1ff:fe1d:611e.domain > dc.55787: 38106 NXDomain* 0/0/1 (52)
23:18:44.822682 IP6 dc.55787 > fe80::a691:b1ff:fe1d:611e.domain: 38106+ PTR? 185.1.1.10.in-addr.arpa. (41)
23:18:44.826852 IP6 fe80::a691:b1ff:fe1d:611e.domain > dc.55787: 38106 NXDomain* 0/0/0 (41)
23:18:45.252378 ARP, Request who-has 10.1.1.221 tell dsldevice.lan, length 46
23:18:45.841495 IP6 dc.56380 > fe80::a691:b1ff:fe1d:611e.domain: 9790+ [1au] PTR? 221.1.1.10.in-addr.arpa. (52)
23:18:45.856639 IP6 fe80::a691:b1ff:fe1d:611e.domain > dc.56380: 9790 NXDomain* 0/0/1 (52)
23:18:45.856773 IP6 dc.56380 > fe80::a691:b1ff:fe1d:611e.domain: 9790+ PTR? 221.1.1.10.in-addr.arpa. (41)
23:18:45.859784 IP6 fe80::a691:b1ff:fe1d:611e.domain > dc.56380: 9790 NXDomain* 0/0/0 (41)
23:18:47.195487 ARP, Request who-has 10.1.1.221 tell dsldevice.lan, length 46
23:18:47.815131 IP6 fe80::1ce7:fd37:e1fe:4c4b.mdns > ff02::fb.mdns: 0*- [0q] 5/0/1 PTR Living Room._companion-link._tcp.local., TXT "model=J105aAP", PTR Living Room._airplay._tcp.local., PTR CCD2816AA467@Living Room._raop._tcp.local., PTR 70-35-60-63.1 Living Room._sleep-proxy._udp.local. (276)
23:18:49.243581 ARP, Request who-has 10.1.1.221 tell dsldevice.lan, length 46
23:18:51.293551 ARP, Request who-has Linksys01227.lan tell dsldevice.lan, length 46
23:18:51.293551 ARP, Request who-has 10.1.1.138 tell dsldevice.lan, length 46
23:18:51.293551 ARP, Request who-has SonosFR.lan tell dsldevice.lan, length 46
23:18:51.985328 IP6 dc.42596 > fe80::a691:b1ff:fe1d:611e.domain: 55855+ [1au] PTR? 93.1.1.10.in-addr.arpa. (51)
23:18:51.991216 IP6 fe80::a691:b1ff:fe1d:611e.domain > dc.42596: 55855* 1/0/1 PTR Linksys01227.lan. (81)
23:18:51.992075 IP6 dc.47642 > fe80::a691:b1ff:fe1d:611e.domain: 17992+ [1au] PTR? 138.1.1.10.in-addr.arpa. (52)
23:18:51.996494 IP6 fe80::a691:b1ff:fe1d:611e.domain > dc.47642: 17992 NXDomain* 0/0/1 (52)
23:18:51.996661 IP6 dc.47642 > fe80::a691:b1ff:fe1d:611e.domain: 17992+ PTR? 138.1.1.10.in-addr.arpa. (41)
23:18:51.999642 IP6 fe80::a691:b1ff:fe1d:611e.domain > dc.47642: 17992 NXDomain* 0/0/0 (41)
23:18:52.000306 IP6 dc.45794 > fe80::a691:b1ff:fe1d:611e.domain: 65200+ [1au] PTR? 160.1.1.10.in-addr.arpa. (52)
23:18:52.003862 IP6 fe80::a691:b1ff:fe1d:611e.domain > dc.45794: 65200* 1/0/1 PTR SonosFR.lan. (77)
23:18:52.944104 ARP, Request who-has Living-Room.lan tell Living-Room.lan, length 46
23:18:52.944104 ARP, Request who-has 169.254.255.255 tell Living-Room.lan, length 46
23:18:52.944128 IP6 :: > ff02::1:ffdf:e0d5: ICMP6, neighbor solicitation, who has fd24:87a5:b2fd:0:65:dc85:74df:e0d5, length 32
23:18:53.035925 ARP, Request who-has dsldevice.lan tell Living-Room.lan, length 46
23:18:53.114172 IP6 dc.mdns > ff02::fb.mdns: 0 PTR (QM)? 255.255.254.169.in-addr.arpa. (46)
23:18:53.114225 IP dc.lan.mdns > mdns.mcast.net.mdns: 0 PTR (QM)? 255.255.254.169.in-addr.arpa. (46)
23:18:53.238107 ARP, Request who-has 169.254.255.255 tell Living-Room.lan, length 46
23:18:53.238107 ARP, Request who-has Linksys01227.lan tell dsldevice.lan, length 46
23:18:53.449649 ARP, Request who-has Linksys01196.lan tell Living-Room.lan, length 46
23:18:53.546311 ARP, Request who-has Linksys01219.lan tell Living-Room.lan, length 46
23:18:53.546312 ARP, Request who-has Linksys01227.lan tell Living-Room.lan, length 46
23:18:53.546312 ARP, Request who-has 169.254.255.255 tell Living-Room.lan, length 46
23:18:53.755937 IP6 fe80::1ce7:fd37:e1fe:4c4b.mdns > ff02::fb.mdns: 0 [5q] [7n] [1au] ANY (QM)? Living Room._companion-link._tcp.local. ANY (QM)? Living Room._airplay._tcp.local. ANY (QM)? CCD2816AA467@Living Room._raop._tcp.local. ANY (QM)? 70-35-60-63.1 Living Room._sleep-proxy._udp.local. ANY (QM)? Living-Room.local. (363)
23:18:53.851452 ARP, Request who-has 169.254.255.255 tell Living-Room.lan, length 46
23:18:53.966354 IP6 fe80::1ce7:fd37:e1fe:4c4b.mdns > ff02::fb.mdns: 0 [5q] [7n] [1au] ANY (QM)? Living Room._companion-link._tcp.local. ANY (QM)? Living Room._airplay._tcp.local. ANY (QM)? CCD2816AA467@Living Room._raop._tcp.local. ANY (QM)? 70-35-60-63.1 Living Room._sleep-proxy._udp.local. ANY (QM)? Living-Room.local. (363)
23:18:53.969429 IP6 fe80::1ce7:fd37:e1fe:4c4b.mdns > ff02::fb.mdns: 0*- [0q] 3/0/4 (Cache flush) PTR Living-Room.local., (Cache flush) PTR Living-Room.local., (Cache flush) PTR Living-Room.local. (301)
23:18:53.969429 ARP, Request who-has Linksys01196.lan tell Living-Room.lan, length 46
23:18:54.062639 ARP, Request who-has Linksys01227.lan tell Living-Room.lan, length 46
23:18:54.062639 ARP, Request who-has Linksys01219.lan tell Living-Room.lan, length 46
23:18:54.062639 ARP, Request who-has dsldevice.lan tell Living-Room.lan, length 46
23:18:54.114691 IP6 dc.mdns > ff02::fb.mdns: 0 PTR (QM)? 255.255.254.169.in-addr.arpa. (46)
23:18:54.114747 IP dc.lan.mdns > mdns.mcast.net.mdns: 0 PTR (QM)? 255.255.254.169.in-addr.arpa. (46)
23:18:54.270777 ARP, Request who-has 169.254.255.255 tell Living-Room.lan, length 46
23:18:54.270778 ARP, Request who-has Living-Room.lan tell Living-Room.lan, length 46
23:18:54.284065 IP Living-Room.lan.mdns > mdns.mcast.net.mdns: 0*- [0q] 20/0/6 (Cache flush) TXT "rpMac=2" "rpHN=8b13df673ee7" "rpFl=0xB6782" "rpMd=AppleTV6,2" "rpVr=550.9.2" "rpMRtID=F1F22215-8C2A-4858-A86C-73897E98B140" "rpAD=9679cdd84dda" "rpBA=CD:CF:79:61:05:1D", PTR _companion-link._tcp.local., PTR Living Room._companion-link._tcp.local., TXT "model=J105aAP", (Cache flush) SRV Living-Room.local.:49153 0 0, (Cache flush) TXT "acl=0" "btaddr=71:7E:26:95:A4:04" "deviceid=CC:D2:81:6A:A4:67" "fex=1d9/St5fF7w4oQY" "features=0x4A7FDFD5,0xBC175FDE" "flags=0x244" "gid=F1A2B191-3910-4CCB-BB81-4C96D4CEC065" "igl=1" "gcgl=1" "model=AppleTV6,2" "protovers=1.1" "pi=03c4b051-fd43-4ad1-844b-ade242df11c7" "psi=F1F22215-8C2A-4858-A86C-73897E98B140" "pk=a22304c072843285d3a7ee7403b7a7e374e3e313c2386147db4ce024864940d6" "srcvers=770.8.1" "osvers=17.5.1" "vv=1", PTR _airplay._tcp.local., PTR Living Room._airplay._tcp.local., (Cache flush) TXT "cn=0,1,2,3" "da=true" "et=0,3,5" "ft=0x4A7FDFD5,0xBC175FDE" "sf=0x244" "md=0,1,2" "am=AppleTV6,2" "pk=a22304c072843285d3a7ee7403b7a7e374e3e313c2386147db4ce024864940d6" "tp=UDP" "vn=65537" "vs=770.8.1" "ov=17.5.1" "vv=1", PTR _raop._tcp.local., PTR CCD2816AA467@Living Room._raop._tcp.local., (Cache flush) SRV Living-Room.local.:7000 0 0, (Cache flush) SRV Living-Room.local.:7000 0 0, (Cache flush) TXT "", PTR _sleep-proxy._udp.local., PTR 70-35-60-63.1 Living Room._sleep-proxy._udp.local., (Cache flush) SRV Living-Room.local.:51794 0 0, (Cache flush) AAAA fe80::1ce7:fd37:e1fe:4c4b, (Cache flush) A 10.1.1.108, (Cache flush) AAAA fd24:87a5:b2fd:0:65:dc85:74df:e0d5 (1406)
23:18:54.287572 IP6 fe80::1ce7:fd37:e1fe:4c4b.mdns > ff02::fb.mdns: 0*- [0q] 20/0/6 (Cache flush) TXT "rpMac=2" "rpHN=8b13df673ee7" "rpFl=0xB6782" "rpMd=AppleTV6,2" "rpVr=550.9.2" "rpMRtID=F1F22215-8C2A-4858-A86C-73897E98B140" "rpAD=9679cdd84dda" "rpBA=CD:CF:79:61:05:1D", PTR _companion-link._tcp.local., PTR Living Room._companion-link._tcp.local., TXT "model=J105aAP", (Cache flush) SRV Living-Room.local.:49153 0 0, (Cache flush) TXT "acl=0" "btaddr=71:7E:26:95:A4:04" "deviceid=CC:D2:81:6A:A4:67" "fex=1d9/St5fF7w4oQY" "features=0x4A7FDFD5,0xBC175FDE" "flags=0x244" "gid=F1A2B191-3910-4CCB-BB81-4C96D4CEC065" "igl=1" "gcgl=1" "model=AppleTV6,2" "protovers=1.1" "pi=03c4b051-fd43-4ad1-844b-ade242df11c7" "psi=F1F22215-8C2A-4858-A86C-73897E98B140" "pk=a22304c072843285d3a7ee7403b7a7e374e3e313c2386147db4ce024864940d6" "srcvers=770.8.1" "osvers=17.5.1" "vv=1", PTR _airplay._tcp.local., PTR Living Room._airplay._tcp.local., (Cache flush) TXT "cn=0,1,2,3" "da=true" "et=0,3,5" "ft=0x4A7FDFD5,0xBC175FDE" "sf=0x244" "md=0,1,2" "am=AppleTV6,2" "pk=a22304c072843285d3a7ee7403b7a7e374e3e313c2386147db4ce024864940d6" "tp=UDP" "vn=65537" "vs=770.8.1" "ov=17.5.1" "vv=1", PTR _raop._tcp.local., PTR CCD2816AA467@Living Room._raop._tcp.local., (Cache flush) SRV Living-Room.local.:7000 0 0, (Cache flush) SRV Living-Room.local.:7000 0 0, (Cache flush) TXT "", PTR _sleep-proxy._udp.local., PTR 70-35-60-63.1 Living Room._sleep-proxy._udp.local., (Cache flush) SRV Living-Room.local.:51794 0 0, (Cache flush) AAAA fe80::1ce7:fd37:e1fe:4c4b, (Cache flush) A 10.1.1.108, (Cache flush) AAAA fd24:87a5:b2fd:0:65:dc85:74df:e0d5 (1406)
23:18:54.568274 ARP, Request who-has dsldevice.lan tell Living-Room.lan, length 46
23:18:54.881262 IP6 fe80::869:5eb9:11e0:f4ca.mdns > ff02::fb.mdns: 0 [5q] PTR (QM)? _companion-link._tcp.local. PTR (QM)? _rdlink._tcp.local. PTR (QM)? lb._dns-sd._udp.local. PTR (QM)? _homekit._tcp.local. PTR (QM)? _sleep-proxy._udp.local. (114)
23:18:54.984731 IP 10.1.1.248.mdns > mdns.mcast.net.mdns: 0*- [0q] 2/0/7 PTR DanielM-bM-^@M-^Ys iPad._companion-link._tcp.local., TXT "model=J271AP" (373)
23:18:54.984798 IP6 fe80::8cf:38a7:5b1e:7f1d.mdns > ff02::fb.mdns: 0*- [0q] 2/0/7 PTR DanielM-bM-^@M-^Ys iPad._companion-link._tcp.local., TXT "model=J271AP" (373)
23:18:55.305870 IP Living-Room.lan.mdns > mdns.mcast.net.mdns: 0*- [0q] 20/0/6 (Cache flush) TXT "rpMac=2" "rpHN=8b13df673ee7" "rpFl=0xB6782" "rpMd=AppleTV6,2" "rpVr=550.9.2" "rpMRtID=F1F22215-8C2A-4858-A86C-73897E98B140" "rpAD=9679cdd84dda" "rpBA=CD:CF:79:61:05:1D", PTR _companion-link._tcp.local., PTR Living Room._companion-link._tcp.local., TXT "model=J105aAP", (Cache flush) SRV Living-Room.local.:49153 0 0, (Cache flush) TXT "acl=0" "btaddr=71:7E:26:95:A4:04" "deviceid=CC:D2:81:6A:A4:67" "fex=1d9/St5fF7w4oQY" "features=0x4A7FDFD5,0xBC175FDE" "flags=0x244" "gid=F1A2B191-3910-4CCB-BB81-4C96D4CEC065" "igl=1" "gcgl=1" "model=AppleTV6,2" "protovers=1.1" "pi=03c4b051-fd43-4ad1-844b-ade242df11c7" "psi=F1F22215-8C2A-4858-A86C-73897E98B140" "pk=a22304c072843285d3a7ee7403b7a7e374e3e313c2386147db4ce024864940d6" "srcvers=770.8.1" "osvers=17.5.1" "vv=1", PTR _airplay._tcp.local., PTR Living Room._airplay._tcp.local., (Cache flush) TXT "cn=0,1,2,3" "da=true" "et=0,3,5" "ft=0x4A7FDFD5,0xBC175FDE" "sf=0x244" "md=0,1,2" "am=AppleTV6,2" "pk=a22304c072843285d3a7ee7403b7a7e374e3e313c2386147db4ce024864940d6" "tp=UDP" "vn=65537" "vs=770.8.1" "ov=17.5.1" "vv=1", PTR _raop._tcp.local., PTR CCD2816AA467@Living Room._raop._tcp.local., (Cache flush) SRV Living-Room.local.:7000 0 0, (Cache flush) SRV Living-Room.local.:7000 0 0, (Cache flush) TXT "", PTR _sleep-proxy._udp.local., PTR 70-35-60-63.1 Living Room._sleep-proxy._udp.local., (Cache flush) SRV Living-Room.local.:51794 0 0, (Cache flush) AAAA fe80::1ce7:fd37:e1fe:4c4b, (Cache flush) A 10.1.1.108, (Cache flush) AAAA fd24:87a5:b2fd:0:65:dc85:74df:e0d5 (1406)
23:18:55.308494 IP6 fe80::1ce7:fd37:e1fe:4c4b.mdns > ff02::fb.mdns: 0*- [0q] 20/0/6 (Cache flush) TXT "rpMac=2" "rpHN=8b13df673ee7" "rpFl=0xB6782" "rpMd=AppleTV6,2" "rpVr=550.9.2" "rpMRtID=F1F22215-8C2A-4858-A86C-73897E98B140" "rpAD=9679cdd84dda" "rpBA=CD:CF:79:61:05:1D", PTR _companion-link._tcp.local., PTR Living Room._companion-link._tcp.local., TXT "model=J105aAP", (Cache flush) SRV Living-Room.local.:49153 0 0, (Cache flush) TXT "acl=0" "btaddr=71:7E:26:95:A4:04" "deviceid=CC:D2:81:6A:A4:67" "fex=1d9/St5fF7w4oQY" "features=0x4A7FDFD5,0xBC175FDE" "flags=0x244" "gid=F1A2B191-3910-4CCB-BB81-4C96D4CEC065" "igl=1" "gcgl=1" "model=AppleTV6,2" "protovers=1.1" "pi=03c4b051-fd43-4ad1-844b-ade242df11c7" "psi=F1F22215-8C2A-4858-A86C-73897E98B140" "pk=a22304c072843285d3a7ee7403b7a7e374e3e313c2386147db4ce024864940d6" "srcvers=770.8.1" "osvers=17.5.1" "vv=1", PTR _airplay._tcp.local., PTR Living Room._airplay._tcp.local., (Cache flush) TXT "cn=0,1,2,3" "da=true" "et=0,3,5" "ft=0x4A7FDFD5,0xBC175FDE" "sf=0x244" "md=0,1,2" "am=AppleTV6,2" "pk=a22304c072843285d3a7ee7403b7a7e374e3e313c2386147db4ce024864940d6" "tp=UDP" "vn=65537" "vs=770.8.1" "ov=17.5.1" "vv=1", PTR _raop._tcp.local., PTR CCD2816AA467@Living Room._raop._tcp.local., (Cache flush) SRV Living-Room.local.:7000 0 0, (Cache flush) SRV Living-Room.local.:7000 0 0, (Cache flush) TXT "", PTR _sleep-proxy._udp.local., PTR 70-35-60-63.1 Living Room._sleep-proxy._udp.local., (Cache flush) SRV Living-Room.local.:51794 0 0, (Cache flush) AAAA fe80::1ce7:fd37:e1fe:4c4b, (Cache flush) A 10.1.1.108, (Cache flush) AAAA fd24:87a5:b2fd:0:65:dc85:74df:e0d5 (1406)
23:18:55.804573 IP SonosFR.lan.49953 > 255.255.255.255.1900: UDP, length 483
23:18:55.903838 IP6 fe80::869:5eb9:11e0:f4ca.mdns > ff02::fb.mdns: 0 [3a] [5q] PTR (QM)? _companion-link._tcp.local. PTR (QM)? _rdlink._tcp.local. PTR (QM)? lb._dns-sd._udp.local. PTR (QM)? _homekit._tcp.local. PTR (QM)? _sleep-proxy._udp.local. (210)
23:18:56.115419 IP6 dc.mdns > ff02::fb.mdns: 0 PTR (QM)? 255.255.254.169.in-addr.arpa. (46)
23:18:56.115469 IP dc.lan.mdns > mdns.mcast.net.mdns: 0 PTR (QM)? 255.255.254.169.in-addr.arpa. (46)
23:18:56.115538 IP SonosFR.lan.49953 > 255.255.255.255.1900: UDP, length 536
23:18:56.115579 IP6 fe80::1ce7:fd37:e1fe:4c4b.mdns > ff02::fb.mdns: 0*- [0q] 3/0/4 (Cache flush) PTR Living-Room.local., (Cache flush) PTR Living-Room.local., (Cache flush) PTR Living-Room.local. (301)
23:18:56.127402 IP 10.1.1.12.mdns > mdns.mcast.net.mdns: 0 [5q] [1n] [1au] PTR (QU)? _companion-link._tcp.local. PTR (QU)? _homekit._tcp.local. PTR (QU)? lb._dns-sd._udp.local. PTR (QU)? _sleep-proxy._udp.local. ANY (QU)? EvanM-bM-^@M-^Ys iPad._rdlink._tcp.local. (188)
23:18:56.127402 IP6 fe80::c35:5f65:7908:cc20.mdns > ff02::fb.mdns: 0 [5q] [1n] [1au] PTR (QU)? _companion-link._tcp.local. PTR (QU)? _homekit._tcp.local. PTR (QU)? lb._dns-sd._udp.local. PTR (QU)? _sleep-proxy._udp.local. ANY (QU)? EvanM-bM-^@M-^Ys iPad._rdlink._tcp.local. (188)
23:18:56.127402 IP 10.1.1.12.mdns > mdns.mcast.net.mdns: 0*- [0q] 5/0/4 TXT "model=J407AP", PTR _rdlink._tcp.local., (Cache flush) PTR Evans-iPad.local., (Cache flush) PTR Evans-iPad.local., (Cache flush) PTR Evans-iPad.local. (407)
23:18:56.129108 IP6 fe80::c35:5f65:7908:cc20.mdns > ff02::fb.mdns: 0*- [0q] 5/0/4 TXT "model=J407AP", PTR _rdlink._tcp.local., (Cache flush) PTR Evans-iPad.local., (Cache flush) PTR Evans-iPad.local., (Cache flush) PTR Evans-iPad.local. (407)
23:18:56.318907 IP SonosFR.lan.49953 > 255.255.255.255.1900: UDP, length 486
23:18:56.318910 IP 10.1.1.12.mdns > mdns.mcast.net.mdns: 0 [1n] [1au] ANY (QM)? EvanM-bM-^@M-^Ys iPad._rdlink._tcp.local. (110)
23:18:56.318910 IP6 fe80::c35:5f65:7908:cc20.mdns > ff02::fb.mdns: 0 [1n] [1au] ANY (QM)? EvanM-bM-^@M-^Ys iPad._rdlink._tcp.local. (110)
23:18:56.514195 ARP, Request who-has 10.1.1.248 tell Living-Room.lan, length 46
23:18:56.619404 IP 10.1.1.12.mdns > mdns.mcast.net.mdns: 0 [3n] [1au] ANY (QU)? Evans-iPad.local. (135)
23:18:56.619405 IP6 fe80::c35:5f65:7908:cc20.mdns > ff02::fb.mdns: 0 [3n] [1au] ANY (QU)? Evans-iPad.local. (135)
23:18:56.721312 IP 10.1.1.12.mdns > mdns.mcast.net.mdns: 0 [1n] [1au] ANY (QM)? EvanM-bM-^@M-^Ys iPad._rdlink._tcp.local. (110)
23:18:56.721312 IP6 fe80::c35:5f65:7908:cc20.mdns > ff02::fb.mdns: 0 [1n] [1au] ANY (QM)? EvanM-bM-^@M-^Ys iPad._rdlink._tcp.local. (110)
23:18:57.058047 IP 10.1.1.12.mdns > mdns.mcast.net.mdns: 0 [3n] [1au] ANY (QM)? Evans-iPad.local. (135)
23:18:57.058048 IP6 fe80::c35:5f65:7908:cc20.mdns > ff02::fb.mdns: 0 [3n] [1au] ANY (QM)? Evans-iPad.local. (135)
23:18:57.058048 IP 10.1.1.12.mdns > mdns.mcast.net.mdns: 0*- [0q] 4/0/2 TXT "model=J407AP", (Cache flush) TXT "rpBA=4E:CA:83:A5:C5:C5" "rpVr=410.6" "rpAD=55645a027b33", PTR EvanM-bM-^@M-^Ys iPad._rdlink._tcp.local., (Cache flush) SRV Evans-iPad.local.:49155 0 0 (255)
23:18:57.062907 IP6 fe80::c35:5f65:7908:cc20.mdns > ff02::fb.mdns: 0*- [0q] 4/0/2 TXT "model=J407AP", (Cache flush) TXT "rpBA=4E:CA:83:A5:C5:C5" "rpVr=410.6" "rpAD=55645a027b33", PTR EvanM-bM-^@M-^Ys iPad._rdlink._tcp.local., (Cache flush) SRV Evans-iPad.local.:49155 0 0 (255)
23:18:57.063116 IP6 fe80::a691:b1ff:fe1d:611e > dc: ICMP6, neighbor solicitation, who has dc, length 32
23:18:57.063140 IP6 dc > fe80::a691:b1ff:fe1d:611e: ICMP6, neighbor advertisement, tgt is dc, length 24
23:18:57.549544 IP 10.1.1.12.mdns > mdns.mcast.net.mdns: 0 [3n] [1au] ANY (QM)? Evans-iPad.local. (135)
23:18:57.549545 IP6 fe80::c35:5f65:7908:cc20.mdns > ff02::fb.mdns: 0 [3n] [1au] ANY (QM)? Evans-iPad.local. (135)
23:18:57.549545 IP 10.1.1.12.mdns > mdns.mcast.net.mdns: 0*- [0q] 4/0/4 PTR _rdlink._tcp.local., (Cache flush) PTR Evans-iPad.local., (Cache flush) PTR Evans-iPad.local., (Cache flush) PTR Evans-iPad.local. (355)
23:18:57.653041 IP6 fe80::c35:5f65:7908:cc20.mdns > ff02::fb.mdns: 0*- [0q] 4/0/4 PTR _rdlink._tcp.local., (Cache flush) PTR Evans-iPad.local., (Cache flush) PTR Evans-iPad.local., (Cache flush) PTR Evans-iPad.local. (355)
23:18:57.653042 IP 10.1.1.12.mdns > mdns.mcast.net.mdns: 0 [3a] [4q] [1au] PTR (QM)? _companion-link._tcp.local. PTR (QM)? _homekit._tcp.local. PTR (QM)? lb._dns-sd._udp.local. PTR (QM)? _sleep-proxy._udp.local. (225)
23:18:57.653042 IP6 fe80::c35:5f65:7908:cc20.mdns > ff02::fb.mdns: 0 [3a] [4q] [1au] PTR (QM)? _companion-link._tcp.local. PTR (QM)? _homekit._tcp.local. PTR (QM)? lb._dns-sd._udp.local. PTR (QM)? _sleep-proxy._udp.local. (225)
23:18:57.661883 IP Living-Room.lan.mdns > mdns.mcast.net.mdns: 0*- [0q] 20/0/6 (Cache flush) TXT "rpMac=2" "rpHN=8b13df673ee7" "rpFl=0xB6782" "rpMd=AppleTV6,2" "rpVr=550.9.2" "rpMRtID=F1F22215-8C2A-4858-A86C-73897E98B140" "rpAD=9679cdd84dda" "rpBA=CD:CF:79:61:05:1D", PTR _companion-link._tcp.local., PTR Living Room._companion-link._tcp.local., TXT "model=J105aAP", (Cache flush) SRV Living-Room.local.:49153 0 0, (Cache flush) TXT "acl=0" "btaddr=71:7E:26:95:A4:04" "deviceid=CC:D2:81:6A:A4:67" "fex=1d9/St5fF7w4oQY" "features=0x4A7FDFD5,0xBC175FDE" "flags=0x244" "gid=F1A2B191-3910-4CCB-BB81-4C96D4CEC065" "igl=1" "gcgl=1" "model=AppleTV6,2" "protovers=1.1" "pi=03c4b051-fd43-4ad1-844b-ade242df11c7" "psi=F1F22215-8C2A-4858-A86C-73897E98B140" "pk=a22304c072843285d3a7ee7403b7a7e374e3e313c2386147db4ce024864940d6" "srcvers=770.8.1" "osvers=17.5.1" "vv=1", PTR _airplay._tcp.local., PTR Living Room._airplay._tcp.local., (Cache flush) TXT "cn=0,1,2,3" "da=true" "et=0,3,5" "ft=0x4A7FDFD5,0xBC175FDE" "sf=0x244" "md=0,1,2" "am=AppleTV6,2" "pk=a22304c072843285d3a7ee7403b7a7e374e3e313c2386147db4ce024864940d6" "tp=UDP" "vn=65537" "vs=770.8.1" "ov=17.5.1" "vv=1", PTR _raop._tcp.local., PTR CCD2816AA467@Living Room._raop._tcp.local., (Cache flush) SRV Living-Room.local.:7000 0 0, (Cache flush) SRV Living-Room.local.:7000 0 0, (Cache flush) TXT "", PTR _sleep-proxy._udp.local., PTR 70-35-60-63.1 Living Room._sleep-proxy._udp.local., (Cache flush) SRV Living-Room.local.:51794 0 0, (Cache flush) AAAA fe80::1ce7:fd37:e1fe:4c4b, (Cache flush) A 10.1.1.108, (Cache flush) AAAA fd24:87a5:b2fd:0:65:dc85:74df:e0d5 (1406)
23:18:57.745964 IP 10.1.1.12.mdns > mdns.mcast.net.mdns: 0*- [0q] 3/0/2 (Cache flush) AAAA fe80::c35:5f65:7908:cc20, (Cache flush) AAAA fd24:87a5:b2fd:0:10e1:6e26:31ea:a95d, (Cache flush) A 10.1.1.12 (149)
23:18:57.745964 IP6 fe80::c35:5f65:7908:cc20.mdns > ff02::fb.mdns: 0*- [0q] 3/0/2 (Cache flush) AAAA fe80::c35:5f65:7908:cc20, (Cache flush) AAAA fd24:87a5:b2fd:0:10e1:6e26:31ea:a95d, (Cache flush) A 10.1.1.12 (149)
23:18:57.954960 IP 10.1.1.12.mdns > mdns.mcast.net.mdns: 0*- [0q] 7/0/3 TXT "model=J407AP", (Cache flush) TXT "rpBA=4E:CA:83:A5:C5:C5" "rpVr=410.6" "rpAD=55645a027b33", PTR EvanM-bM-^@M-^Ys iPad._rdlink._tcp.local., (Cache flush) SRV Evans-iPad.local.:49155 0 0, (Cache flush) AAAA fe80::c35:5f65:7908:cc20, (Cache flush) AAAA fd24:87a5:b2fd:0:10e1:6e26:31ea:a95d, (Cache flush) A 10.1.1.12 (347)
23:18:57.954960 IP6 fe80::c35:5f65:7908:cc20.mdns > ff02::fb.mdns: 0*- [0q] 7/0/3 TXT "model=J407AP", (Cache flush) TXT "rpBA=4E:CA:83:A5:C5:C5" "rpVr=410.6" "rpAD=55645a027b33", PTR EvanM-bM-^@M-^Ys iPad._rdlink._tcp.local., (Cache flush) SRV Evans-iPad.local.:49155 0 0, (Cache flush) AAAA fe80::c35:5f65:7908:cc20, (Cache flush) AAAA fd24:87a5:b2fd:0:10e1:6e26:31ea:a95d, (Cache flush) A 10.1.1.12 (347)
23:18:58.015234 IP6 dc.50295 > fe80::a691:b1ff:fe1d:611e.domain: 18480+ [1au] PTR? 5.d.0.e.f.d.f.f.1.0.0.0.0.0.0.0.0.0.0.0.0.0.0.0.0.0.0.0.2.0.f.f.ip6.arpa. (101)
23:18:58.019358 IP6 fe80::a691:b1ff:fe1d:611e.domain > dc.50295: 18480 NXDomain 0/0/1 (101)
23:18:58.019571 IP6 dc.50295 > fe80::a691:b1ff:fe1d:611e.domain: 18480+ PTR? 5.d.0.e.f.d.f.f.1.0.0.0.0.0.0.0.0.0.0.0.0.0.0.0.0.0.0.0.2.0.f.f.ip6.arpa. (90)
23:18:58.021762 IP6 fe80::a691:b1ff:fe1d:611e.domain > dc.50295: 18480 NXDomain 0/0/0 (90)
23:18:58.022529 IP6 dc.41947 > fe80::a691:b1ff:fe1d:611e.domain: 65083+ [1au] PTR? 5.d.0.e.f.d.4.7.5.8.c.d.5.6.0.0.0.0.0.0.d.f.2.b.5.a.7.8.4.2.d.f.ip6.arpa. (101)
23:18:58.026011 IP6 fe80::a691:b1ff:fe1d:611e.domain > dc.41947: 65083 NXDomain* 0/0/1 (101)
23:18:58.026188 IP6 dc.41947 > fe80::a691:b1ff:fe1d:611e.domain: 65083+ PTR? 5.d.0.e.f.d.4.7.5.8.c.d.5.6.0.0.0.0.0.0.d.f.2.b.5.a.7.8.4.2.d.f.ip6.arpa. (90)
23:18:58.028196 IP6 fe80::a691:b1ff:fe1d:611e.domain > dc.41947: 65083 NXDomain* 0/0/0 (90)
23:18:58.029404 IP6 dc.56064 > fe80::a691:b1ff:fe1d:611e.domain: 29563+ [1au] PTR? e.b.d.1.4.2.8.9.e.6.2.5.8.2.1.d.0.0.0.0.d.f.2.b.5.a.7.8.4.2.d.f.ip6.arpa. (101)
23:18:58.032608 IP6 fe80::a691:b1ff:fe1d:611e.domain > dc.56064: 29563 NXDomain* 0/0/1 (101)
23:18:58.032717 IP6 dc.56064 > fe80::a691:b1ff:fe1d:611e.domain: 29563+ PTR? e.b.d.1.4.2.8.9.e.6.2.5.8.2.1.d.0.0.0.0.d.f.2.b.5.a.7.8.4.2.d.f.ip6.arpa. (90)
23:18:58.034814 IP6 fe80::a691:b1ff:fe1d:611e.domain > dc.56064: 29563 NXDomain* 0/0/0 (90)
23:18:58.035684 IP6 dc.52972 > fe80::a691:b1ff:fe1d:611e.domain: 2905+ [1au] PTR? 243.1.1.10.in-addr.arpa. (52)
23:18:58.038271 IP6 fe80::a691:b1ff:fe1d:611e.domain > dc.52972: 2905* 1/0/1 PTR dc.lan. (72)
23:18:58.038980 IP6 dc.56663 > fe80::a691:b1ff:fe1d:611e.domain: 11964+ [1au] PTR? 153.1.1.10.in-addr.arpa. (52)
23:18:58.041378 IP6 fe80::a691:b1ff:fe1d:611e.domain > dc.56663: 11964* 1/0/1 PTR Linksys01196.lan. (82)
23:18:58.041998 IP6 dc.55445 > fe80::a691:b1ff:fe1d:611e.domain: 23115+ [1au] PTR? 245.1.1.10.in-addr.arpa. (52)
23:18:58.044444 IP6 fe80::a691:b1ff:fe1d:611e.domain > dc.55445: 23115* 1/0/1 PTR Linksys01219.lan. (82)
23:18:58.046845 IP6 dc.42200 > fe80::a691:b1ff:fe1d:611e.domain: 5414+ [1au] PTR? 12.1.1.10.in-addr.arpa. (51)
23:18:58.050848 IP6 fe80::a691:b1ff:fe1d:611e.domain > dc.42200: 5414 NXDomain* 0/0/1 (51)
23:18:58.051113 IP6 dc.42200 > fe80::a691:b1ff:fe1d:611e.domain: 5414+ PTR? 12.1.1.10.in-addr.arpa. (40)
23:18:58.054106 IP6 fe80::a691:b1ff:fe1d:611e.domain > dc.42200: 5414 NXDomain* 0/0/0 (40)
23:18:58.872999 IP 10.1.1.221.mdns > mdns.mcast.net.mdns: 0 [1a] PTR (QM)? _rdlink._tcp.local. (64)
23:18:58.873023 IP6 fe80::869:5eb9:11e0:f4ca.mdns > ff02::fb.mdns: 0 [1a] PTR (QM)? _rdlink._tcp.local. (64)
23:18:58.873067 ARP, Request who-has dc.lan tell dsldevice.lan, length 46
23:18:58.873077 ARP, Reply dc.lan is-at c4:75:ab:c3:ed:ee (oui Unknown), length 28
23:18:59.084839 IP 10.1.1.12.mdns > mdns.mcast.net.mdns: 0*- [0q] 11/0/6 TXT "model=J407AP", (Cache flush) TXT "rpBA=4E:CA:83:A5:C5:C5" "rpVr=410.6" "rpAD=55645a027b33", PTR _rdlink._tcp.local., PTR EvanM-bM-^@M-^Ys iPad._rdlink._tcp.local., (Cache flush) SRV Evans-iPad.local.:49155 0 0, (Cache flush) PTR Evans-iPad.local., (Cache flush) PTR Evans-iPad.local., (Cache flush) PTR Evans-iPad.local., (Cache flush) AAAA fe80::c35:5f65:7908:cc20, (Cache flush) AAAA fd24:87a5:b2fd:0:10e1:6e26:31ea:a95d, (Cache flush) A 10.1.1.12 (632)
23:18:59.084839 IP6 fe80::c35:5f65:7908:cc20.mdns > ff02::fb.mdns: 0*- [0q] 11/0/6 TXT "model=J407AP", (Cache flush) TXT "rpBA=4E:CA:83:A5:C5:C5" "rpVr=410.6" "rpAD=55645a027b33", PTR _rdlink._tcp.local., PTR EvanM-bM-^@M-^Ys iPad._rdlink._tcp.local., (Cache flush) SRV Evans-iPad.local.:49155 0 0, (Cache flush) PTR Evans-iPad.local., (Cache flush) PTR Evans-iPad.local., (Cache flush) PTR Evans-iPad.local., (Cache flush) AAAA fe80::c35:5f65:7908:cc20, (Cache flush) AAAA fd24:87a5:b2fd:0:10e1:6e26:31ea:a95d, (Cache flush) A 10.1.1.12 (632)
23:19:00.118913 IP Living-Room.lan.mdns > mdns.mcast.net.mdns: 0*- [0q] 21/0/1 (Cache flush) TXT "rpMac=2" "rpHN=8b13df673ee7" "rpFl=0xB6782" "rpMd=AppleTV6,2" "rpVr=550.9.2" "rpMRtID=F1F22215-8C2A-4858-A86C-73897E98B140" "rpAD=9679cdd84dda" "rpBA=CD:CF:79:61:05:1D", PTR _companion-link._tcp.local., PTR Living Room._companion-link._tcp.local., TXT "model=J105aAP", (Cache flush) SRV Living-Room.local.:49153 0 0, (Cache flush) TXT "acl=0" "btaddr=71:7E:26:95:A4:04" "deviceid=CC:D2:81:6A:A4:67" "fex=1d9/St5fF7w4oQY" "features=0x4A7FDFD5,0xBC175FDE" "flags=0x244" "gid=F1A2B191-3910-4CCB-BB81-4C96D4CEC065" "igl=1" "gcgl=1" "model=AppleTV6,2" "protovers=1.1" "pi=03c4b051-fd43-4ad1-844b-ade242df11c7" "psi=F1F22215-8C2A-4858-A86C-73897E98B140" "pk=a22304c072843285d3a7ee7403b7a7e374e3e313c2386147db4ce024864940d6" "srcvers=770.8.1" "osvers=17.5.1" "vv=1", PTR _airplay._tcp.local., PTR Living Room._airplay._tcp.local., (Cache flush) TXT "cn=0,1,2,3" "da=true" "et=0,3,5" "ft=0x4A7FDFD5,0xBC175FDE" "sf=0x244" "md=0,1,2" "am=AppleTV6,2" "pk=a22304c072843285d3a7ee7403b7a7e374e3e313c2386147db4ce024864940d6" "tp=UDP" "vn=65537" "vs=770.8.1" "ov=17.5.1" "vv=1", PTR _raop._tcp.local., PTR CCD2816AA467@Living Room._raop._tcp.local., (Cache flush) SRV Living-Room.local.:7000 0 0, (Cache flush) SRV Living-Room.local.:7000 0 0, (Cache flush) TXT "", PTR _sleep-proxy._udp.local., PTR 70-35-60-63.1 Living Room._sleep-proxy._udp.local., (Cache flush) SRV Living-Room.local.:51794 0 0, (Cache flush) PTR Living-Room.local., (Cache flush) PTR Living-Room.local., (Cache flush) PTR Living-Room.local., (Cache flush) A 10.1.1.108 (1441)
23:19:00.118913 IP Living-Room.lan.mdns > mdns.mcast.net.mdns: 0*- [0q] 2/0/1 (Cache flush) AAAA fe80::1ce7:fd37:e1fe:4c4b, (Cache flush) AAAA fd24:87a5:b2fd:0:65:dc85:74df:e0d5 (108)
23:19:00.124604 IP6 fe80::1ce7:fd37:e1fe:4c4b.mdns > ff02::fb.mdns: 0*- [0q] 21/0/1 (Cache flush) TXT "rpMac=2" "rpHN=8b13df673ee7" "rpFl=0xB6782" "rpMd=AppleTV6,2" "rpVr=550.9.2" "rpMRtID=F1F22215-8C2A-4858-A86C-73897E98B140" "rpAD=9679cdd84dda" "rpBA=CD:CF:79:61:05:1D", PTR _companion-link._tcp.local., PTR Living Room._companion-link._tcp.local., TXT "model=J105aAP", (Cache flush) SRV Living-Room.local.:49153 0 0, (Cache flush) TXT "acl=0" "btaddr=71:7E:26:95:A4:04" "deviceid=CC:D2:81:6A:A4:67" "fex=1d9/St5fF7w4oQY" "features=0x4A7FDFD5,0xBC175FDE" "flags=0x244" "gid=F1A2B191-3910-4CCB-BB81-4C96D4CEC065" "igl=1" "gcgl=1" "model=AppleTV6,2" "protovers=1.1" "pi=03c4b051-fd43-4ad1-844b-ade242df11c7" "psi=F1F22215-8C2A-4858-A86C-73897E98B140" "pk=a22304c072843285d3a7ee7403b7a7e374e3e313c2386147db4ce024864940d6" "srcvers=770.8.1" "osvers=17.5.1" "vv=1", PTR _airplay._tcp.local., PTR Living Room._airplay._tcp.local., (Cache flush) TXT "cn=0,1,2,3" "da=true" "et=0,3,5" "ft=0x4A7FDFD5,0xBC175FDE" "sf=0x244" "md=0,1,2" "am=AppleTV6,2" "pk=a22304c072843285d3a7ee7403b7a7e374e3e313c2386147db4ce024864940d6" "tp=UDP" "vn=65537" "vs=770.8.1" "ov=17.5.1" "vv=1", PTR _raop._tcp.local., PTR CCD2816AA467@Living Room._raop._tcp.local., (Cache flush) SRV Living-Room.local.:7000 0 0, (Cache flush) SRV Living-Room.local.:7000 0 0, (Cache flush) TXT "", PTR _sleep-proxy._udp.local., PTR 70-35-60-63.1 Living Room._sleep-proxy._udp.local., (Cache flush) SRV Living-Room.local.:51794 0 0, (Cache flush) PTR Living-Room.local., (Cache flush) PTR Living-Room.local., (Cache flush) PTR Living-Room.local., (Cache flush) A 10.1.1.108 (1441)
23:19:00.204808 IP 10.1.1.12.mdns > mdns.mcast.net.mdns: 0 [3a] [4q] [1au] PTR (QM)? _companion-link._tcp.local. PTR (QM)? _homekit._tcp.local. PTR (QM)? lb._dns-sd._udp.local. PTR (QM)? _sleep-proxy._udp.local. (225)
23:19:00.204808 IP6 fe80::c35:5f65:7908:cc20.mdns > ff02::fb.mdns: 0 [3a] [4q] [1au] PTR (QM)? _companion-link._tcp.local. PTR (QM)? _homekit._tcp.local. PTR (QM)? lb._dns-sd._udp.local. PTR (QM)? _sleep-proxy._udp.local. (225)

